{
  "courseInfo": {
    "courseCode": "DI02000051",
    "subcode": "DI02000051",
    "courseTitle": "Environmental Sustainability",
    "subjectName": "Environmental Sustainability",
    "semester": "2nd",
    "program": "Diploma in Engineering",
    "branch": "ALL",
    "level": "Diploma",
    "academicYear": "w.e.f. 2024-25",
    "category": "ESC",
    "prerequisite": "Basic science, Environmental Science and Earth science",
    "departmentId": "",
    "programId": "",
    "departmentName": "Applied Science",
    "programName": "Engineering Diplomas"
  },
  "teachingExamScheme": {
    "teachingScheme": {
      "lecture": 2,
      "lectureHours": 2,
      "tutorial": 0,
      "tutorialHours": 0,
      "practical": 0,
      "practicalHours": 0,
      "credits": 2
    },
    "examinationScheme": {
      "theoryESE": 70,
      "theoryEseMarks": 70,
      "theoryCA": 30,
      "theoryPaMarks": 30,
      "practicalCA": 0,
      "practicalPaMarks": 0,
      "practicalESE": 0,
      "practicalEseMarks": 0,
      "totalMarks": 100
    },
    "courseFlags": {
      "isElective": false,
      "isTheory": true,
      "theoryExamDuration": "3 hours",
      "isPractical": false,
      "practicalExamDuration": "",
      "isFunctional": false,
      "isSemiPractical": false
    }
  },
  "rationale": "This course is designed to introduce engineering students to the principles and practices of environmental sustainability. It will cover the scientific, technical, and policy aspects of sustainability, with an emphasis on practical applications in engineering.",
  "courseOutcomes": [
    {
      "id": "CO1",
      "description": "Understand the basic principles of environmental sustainability, ecosystem and biodiversity",
      "rbtLevel": "R & U",
      "bloomLevel": "Remember & Understanding"
    },
    {
      "id": "CO2", 
      "description": "Develop strategies for waste management and pollution control",
      "rbtLevel": "R, U & A",
      "bloomLevel": "Remember, Understanding & Application"
    },
    {
      "id": "CO3",
      "description": "Evaluate renewable energy technologies",
      "rbtLevel": "R, U & A",
      "bloomLevel": "Remember, Understanding & Application"
    },
    {
      "id": "CO4",
      "description": "Analyze the impact of climate change",
      "rbtLevel": "R, U & A",
      "bloomLevel": "Remember, Understanding & Application"
    },
    {
      "id": "CO5",
      "description": "Adopt cleaner technologies in relevant field in compliance with various environmental policies",
      "rbtLevel": "R, U & A",
      "bloomLevel": "Remember, Understanding & Application"
    }
  ],
  "courseContent": [
    {
      "unitNumber": "1",
      "unitTitle": "Introduction to Environmental Sustainability, Ecosystem and Biodiversity",
      "content": [
        "1.1 Definition and scope of sustainability, Structure and function of ecosystems",
        "1.2 Various natural cycles like carbon, Nitrogen, Sulphur, Phosphorus",
        "1.3 Importance of biodiversity, Threats to biodiversity and conservation strategies"
      ],
      "hours": 4,
      "weightage": 10
    },
    {
      "unitNumber": "2",
      "unitTitle": "Waste Management and Pollution Control",
      "content": [
        "2.1 Air pollution, classification and its sources, Air pollution control equipments",
        "2.2 Water pollution parameters like BOD, COD, pH, Total suspended solids, Turbidity, Total Solids",
        "2.3 Waste water treatment like primary, secondary and tertiary, Solid waste generation, sources and characteristics",
        "2.4 Collection and disposal of Municipal solid waste and Hazardous waste",
        "2.5 Noise pollution and its effects, Plastic waste and its hazard, E-waste and its hazard"
      ],
      "hours": 7,
      "weightage": 25
    },
    {
      "unitNumber": "3",
      "unitTitle": "Renewable Energy Technologies",
      "content": [
        "3.1 Importance of renewable energy in reducing carbon footprint and combating climate change",
        "3.2 Comparison of renewable energy with non-renewable energy sources",
        "3.3 Photovoltaic (PV) solar cells: Principles of PV technology and types of solar cells",
        "3.4 Wind Energy Technologies: Horizontal-axis wind turbines (HAWT) vs. vertical-axis wind turbines (VAWT), Components and operation of wind turbines, Bladeless wind turbines",
        "3.5 Bioenergy: Biofuels (ethanol, biodiesel, biogas), Biomass (solid, liquid, gaseous forms), Algae biofuels, Biomass gasification",
        "3.6 New energy sources: Geothermal energy, Ocean energy sources, Tidal energy conversion, Hydrogen energy"
      ],
      "hours": 7,
      "weightage": 25
    },
    {
      "unitNumber": "4",
      "unitTitle": "Climate Change: Science and Solutions",
      "content": [
        "4.1 Earth's climate system and the greenhouse effect, Greenhouse gases (GHGs) and their sources",
        "4.2 Evidence of climate change like Temperature records, Melting ice caps and glaciers, Rising sea levels, Changes in precipitation patterns, Increased frequency and intensity of extreme weather events",
        "4.3 Impacts of Climate Change: Biodiversity loss, Ocean acidification, Desertification, Social and economic impacts",
        "4.4 Climate Change Mitigation: Strategies to reduce greenhouse gas emissions like Energy efficiency and conservation, Transition to renewable energy sources, Carbon capture and storage (CCS), Sustainable land use and forestry"
      ],
      "hours": 6,
      "weightage": 20
    },
    {
      "unitNumber": "5",
      "unitTitle": "Environmental Policy and Governance",
      "content": [
        "5.1 Environmental policies in India like Air act, water act, Environment protection act, wild life protection act, Forest conservation act, Biodiversity act",
        "5.2 Sustainable practices like Environmental management system: ISO 14000, definition and benefits",
        "5.3 Rain water harvesting, Green building and rating system in India, Cradle to cradle concept and Life cycle analysis, Green label, Carbon credit system its advantages and disadvantages",
        "5.4 Concept of 5R (Refuse, Reduce, Reuse, Repurpose, Recycle)",
        "5.5 Eco tourism: advantages and disadvantages"
      ],
      "hours": 6,
      "weightage": 20
    }
  ],
  "projectList": [
    {
      "title": "Wind energy micro-project",
      "description": "Undertake micro-projects in teams based on Wind energy",
      "domain": "Renewable Energy"
    },
    {
      "title": "Solar Energy micro-project",
      "description": "Undertake micro-projects in teams based on Solar Energy",
      "domain": "Renewable Energy"
    },
    {
      "title": "Natural cycles project",
      "description": "Undertake micro-projects in teams based on Natural cycles",
      "domain": "Environmental Science"
    },
    {
      "title": "Best out of waste project",
      "description": "Undertake micro-projects in teams based on Best out of waste",
      "domain": "Waste Management"
    },
    {
      "title": "Field visits project",
      "description": "Undertake micro-projects in teams based on field visits",
      "domain": "Environmental Studies"
    }
  ],
  "studentActivities": [
    "Prepare specification of some renewable sources of energy",
    "Undertake micro-projects in teams",
    "Give seminar on any relevant topic",
    "Undertake a market survey of different green materials",
    "Prepare report on various issues related to environment, climate change and sustainable development",
    "Compare the pollution (water, air and noise) data of various cities with standard values laid by pollution control board",
    "Undertake some small mini projects on various issues related to environment and sustainable development",
    "Submit a report on visit to an energy park",
    "Prepare PowerPoint presentation on clean and green technologies",
    "Submit a report on visit to garbage disposal system in your city/town",
    "Submit a report on Carbon capture and storage",
    "Submit a report on analysis of the life cycle of any one or two eco-friendly products"
  ],
  "learningResources": {
    "books": [
      {
        "srNo": 1,
        "title": "Renewable Energy Technologies: A Practical Guide for Beginners",
        "author": "Solanki, Chetan Singh",
        "publication": "PHI Learning, New Delhi, 2010",
        "isbn": "9788120334342"
      },
      {
        "srNo": 2,
        "title": "Ecology and Control of the Natural Environment",
        "author": "Izrael, Y.A.",
        "publication": "Kluwer Academic Publisher",
        "isbn": "978-94-011-3390-6"
      },
      {
        "srNo": 3,
        "title": "Green Technologies and Environmental Sustainability",
        "author": "Singh, Ritu; Kumar, Sanjeev",
        "publication": "Springer International Publishing, 2017",
        "isbn": "978-3-319-50654-8"
      }
    ],
    "websites": [
      {
        "title": "NPTEL IIT Madras",
        "url": "https://www.nptel.iitm.ac.in",
        "type": "Educational Resources"
      },
      {
        "title": "Khan Academy",
        "url": "https://www.khanacademy.org",
        "type": "Educational Resources"
      },
      {
        "title": "Gujarat Pollution Control Board",
        "url": "https://gpcb.gujarat.gov.in",
        "type": "Government Resources"
      }
    ]
  },
  "metadata": {
    "syllabusFormat": "new",
    "createdAt": "2024-12-30T00:00:00Z",
    "updatedAt": "2024-12-30T00:00:00Z",
    "version": "1.0",
    "gtuSyllabusUrl": "http://syllabus.gtu.ac.in/",
    "curriculumVersion": "w.e.f. 2024-25",
    "id": "DI02000051",
    "subjectCode": "DI02000051"
  }
}